{
  "checked_at": "2026-09-26",
  "dataset_id": "jev-reference-papers-v1",
  "excluded_candidates": [
    {
      "candidate_id": "consistencygate",
      "reason": "Kept outside the selected ten because it is a preprint and the checked metadata did not establish a version-specific license. Its controlled-corruption setup is a useful design reference, not a basis for claims about real-world effects.",
      "source_url": "https://arxiv.org/abs/2607.22962",
      "title": "ConsistencyGate: Preventing Memory Contamination in LLM Agents via Self-Consistency Admission Control"
    },
    {
      "candidate_id": "longmemeval",
      "reason": "Kept outside this paper set because paper, repository, and dataset terms differ, and corpus/source-material rights need a release-specific review before reuse.",
      "source_url": "https://github.com/xiaowu0162/LongMemEval",
      "title": "LongMemEval: Benchmarking Chat Assistants on Long-Term Interactive Memory"
    },
    {
      "candidate_id": "saraf-label-induced-bias",
      "reason": "Recorded as supplementary, not selected among the ten. Evaluator label sensitivity is adjacent but does not directly test research-goal drift or user-memory effects; publication and method relevance review remains open.",
      "source_url": "https://arxiv.org/abs/2508.21164",
      "title": "Quantifying Label-Induced Bias in Large Language Model Self- and Cross-Evaluations"
    }
  ],
  "intended_use": "Provide a version-pinned bibliography for later human-reviewed claim graphs, annotation design, and paper-level evaluation of research-summary fidelity, context effects, citations, and factual support. These records are not annotations, training data, or a development/holdout split.",
  "papers": [
    {
      "access_status": "open_full_text",
      "authors": [
        "Shomik Jain",
        "Charlotte Park",
        "Matt Viana",
        "Ashia Wilson",
        "Dana Calacci"
      ],
      "canonical_record_url": "https://doi.org/10.1145/3772318.3791915",
      "checked_at": "2026-09-26",
      "doi": "10.1145/3772318.3791915",
      "full_text_url": "https://arxiv.org/pdf/2509.12517v3",
      "license": {
        "applies_to": "The selected arXiv v3 text; ACM’s CHI record also states CC BY 4.0 for the version of record.",
        "evidence_urls": [
          "https://arxiv.org/abs/2509.12517v3",
          "https://doi.org/10.1145/3772318.3791915"
        ],
        "name": "CC BY 4.0",
        "notes": "The authors report increased sycophancy for most tested models, with heterogeneous effects. This does not establish the same effect in JEV.",
        "status": "confirmed_for_selected_version"
      },
      "paper_id": "interaction-context-sycophancy",
      "publication_details": "Article 793, pp. 1–26",
      "publication_year": 2026,
      "scope_limit": "Results concern the models and tasks tested in this study. They do not establish effects in JEV or in research synthesis.",
      "selected_text_version": "arXiv:2509.12517v3; associated CHI 2026 version of record, Article 793",
      "selection_rationale": "Directly tests whether interaction context and generated user-memory profiles affect sycophantic answers; it gives the benchmark a source for varying prior context.",
      "title": "Interaction Context Often Increases Sycophancy in LLMs",
      "topics": [
        "interaction context",
        "sycophancy",
        "user history"
      ],
      "venue": "Proceedings of the CHI Conference on Human Factors in Computing Systems (CHI ’26)"
    },
    {
      "access_status": "open_full_text",
      "authors": [
        "Avneet Kaur"
      ],
      "canonical_record_url": "https://aclanthology.org/2025.findings-emnlp.1241/",
      "checked_at": "2026-09-26",
      "doi": "10.18653/v1/2025.findings-emnlp.1241",
      "full_text_url": "https://aclanthology.org/2025.findings-emnlp.1241.pdf",
      "license": {
        "applies_to": "ACL Anthology article for the selected proceedings version; third-party material is excluded.",
        "evidence_urls": [
          "https://aclanthology.org/2025.findings-emnlp.1241/",
          "https://aclanthology.org/faq/copyright/"
        ],
        "name": "CC BY 4.0",
        "notes": "The ACL Anthology policy states CC BY 4.0 for its materials published since 2016. That policy does not grant rights to separate datasets.",
        "status": "confirmed_for_selected_version"
      },
      "paper_id": "argument-driven-sycophancy",
      "publication_details": "pp. 22803–22812",
      "publication_year": 2025,
      "scope_limit": "The paper studies argumentative prompts in its evaluated setting; it does not test persistent memory or research-goal drift.",
      "selected_text_version": "ACL Anthology proceedings version, Findings of EMNLP 2025",
      "selection_rationale": "Adds an argumentative stance condition, distinct from personal-memory and majority-consensus conditions.",
      "title": "Echoes of Agreement: Argument Driven Sycophancy in Large Language Models",
      "topics": [
        "argument framing",
        "sycophancy",
        "stance"
      ],
      "venue": "Findings of the Association for Computational Linguistics: EMNLP 2025"
    },
    {
      "access_status": "open_full_text",
      "authors": [
        "Xiaochen Zhu",
        "Caiqi Zhang",
        "Tom Stafford",
        "Nigel Collier",
        "Andreas Vlachos"
      ],
      "canonical_record_url": "https://aclanthology.org/2025.acl-long.195/",
      "checked_at": "2026-09-26",
      "doi": "10.18653/v1/2025.acl-long.195",
      "full_text_url": "https://aclanthology.org/2025.acl-long.195.pdf",
      "license": {
        "applies_to": "ACL Anthology article for the selected proceedings version; third-party material is excluded.",
        "evidence_urls": [
          "https://aclanthology.org/2025.acl-long.195/",
          "https://aclanthology.org/faq/copyright/"
        ],
        "name": "CC BY 4.0",
        "notes": "The ACL Anthology policy states CC BY 4.0 for its materials published since 2016. That policy does not grant rights to separate datasets.",
        "status": "confirmed_for_selected_version"
      },
      "paper_id": "conformity-in-llms",
      "publication_details": "pp. 3854–3872",
      "publication_year": 2025,
      "scope_limit": "Majority-answer conformity is a different mechanism from user-specific memory effects; findings should not be merged into one bias score.",
      "selected_text_version": "ACL Anthology proceedings version, ACL 2025 Volume 1",
      "selection_rationale": "Provides a majority-opinion condition that can be separated from a user’s personal history or vendor labels.",
      "title": "Conformity in Large Language Models",
      "topics": [
        "social conformity",
        "majority answers",
        "agreement"
      ],
      "venue": "Proceedings of the 63rd Annual Meeting of the Association for Computational Linguistics, Volume 1: Long Papers"
    },
    {
      "access_status": "open_full_text",
      "authors": [
        "Zidi Xiong",
        "Yuping Lin",
        "Wenya Xie",
        "Pengfei He",
        "Zirui Liu",
        "Jiliang Tang",
        "Himabindu Lakkaraju",
        "Zhen Xiang"
      ],
      "canonical_record_url": "https://aclanthology.org/2026.acl-long.27/",
      "checked_at": "2026-09-26",
      "doi": "10.18653/v1/2026.acl-long.27",
      "full_text_url": "https://aclanthology.org/2026.acl-long.27.pdf",
      "license": {
        "applies_to": "ACL Anthology article for the selected proceedings version; third-party material is excluded.",
        "evidence_urls": [
          "https://aclanthology.org/2026.acl-long.27/",
          "https://aclanthology.org/faq/copyright/"
        ],
        "name": "CC BY 4.0",
        "notes": "The ACL Anthology policy states CC BY 4.0 for its materials published since 2016. That policy does not grant rights to separate datasets.",
        "status": "confirmed_for_selected_version"
      },
      "paper_id": "memory-management-agent-experience",
      "publication_details": "pp. 623–645",
      "publication_year": 2026,
      "scope_limit": "The paper is not specifically a test of user-preference memory or research summarization. Transfer to JEV needs a separate experiment.",
      "selected_text_version": "ACL Anthology proceedings version, ACL 2026 Volume 1",
      "selection_rationale": "Studies how memory insertion and deletion affect agent experience-following and possible error propagation.",
      "title": "How Memory Management Impacts LLM Agents: An Empirical Study of Experience-Following Behavior",
      "topics": [
        "agent memory",
        "memory management",
        "experience following"
      ],
      "venue": "Proceedings of the 64th Annual Meeting of the Association for Computational Linguistics, Volume 1: Long Papers"
    },
    {
      "access_status": "open_full_text",
      "authors": [
        "Zixi Jia",
        "Qinghua Liu",
        "Hexiao Li",
        "Yuyan Chen",
        "Jiqiang Liu"
      ],
      "canonical_record_url": "https://aclanthology.org/2025.findings-acl.1014/",
      "checked_at": "2026-09-26",
      "doi": "10.18653/v1/2025.findings-acl.1014",
      "full_text_url": "https://aclanthology.org/2025.findings-acl.1014.pdf",
      "license": {
        "applies_to": "ACL Anthology article for the selected proceedings version; third-party material is excluded.",
        "evidence_urls": [
          "https://aclanthology.org/2025.findings-acl.1014/",
          "https://aclanthology.org/faq/copyright/"
        ],
        "name": "CC BY 4.0",
        "notes": "The ACL Anthology policy states CC BY 4.0 for its materials published since 2016. The paper license does not establish reuse rights for an associated dataset.",
        "status": "confirmed_for_selected_version"
      },
      "paper_id": "long-term-memory-evaluation",
      "publication_details": "pp. 19759–19777",
      "publication_year": 2025,